{
  "scene_name": "scene",
  "objects": [],
  "lights": [
    {
      "name": "proto_light",
      "type": "ambient",
      "position": {
        "x": 0.0,
        "y": 0.0,
        "z": 3.0
      },
      "luminosity": 0.0,
      "color": {
        "r": 1.0,
        "g": 1.0,
        "b": 1.0
      },
      "rotation": {
        "x": 0.0,
        "y": 0.0,
        "z": 0.0
      }
    },
    {
      "name": "point_light",
      "type": "point",
      "position": {
        "x": 2.0,
        "y": 4.0,
        "z": 1.0
      },
      "luminosity": 20.0,
      "color": {
        "r": 1.0,
        "g": 0.9,
        "b": 0.8
      },
      "rotation": {
        "x": 0.0,
        "y": 0.0,
        "z": 0.0
      }
    }
  ],
  "camera": {
    "position": {
      "x": 5.0,
      "y": 5.0,
      "z": 5.0
    },
    "look_at": {
      "x": 1.0,
      "y": 1.0,
      "z": 1.0
    },
    "up": {
      "x": 0.0,
      "y": 1.0,
      "z": 0.0
    },
    "pane_distance": 35.0,
    "pane_width": 36.0,
    "resolution": {
      "x": 1920,
      "y": 1080
    }
  },
  "background_color": {
    "r": 1.0,
    "g": 1.0,
    "b": 1.0
  }
}