{
    "scene_name": "example",
    "objects": [
        {
            "name": "cube",
            "path": "obj/cube_bare.obj",
            "scale": {
                "x": 1.0,
                "y": 1.0,
                "z": 1.0
            },
            "rotation": {
                "x": 0.0,
                "y": 0.0,
                "z": 0.0
            },
            "translation": {
                "x": 0.0,
                "y": 0.0,
                "z": 0.0
            }
        }
    ],
    "background_color": {
        "r": 0.0,
        "g": 0.0,
        "b": 0.0
    },
    "camera": {
        "position": {
            "x": 3.5,
            "y": 3.5,
            "z": 3.0
        },
        "look_at": {
            "x": 0.0,
            "y": 0.0,
            "z": 0.0
        },
        "up": {
            "x": 5.0,
            "y": -10.0,
            "z": 0.0
        },
        "pane_distance": 50.0,
        "pane_width": 100.0,
        "resolution": {
            "x": 1920,
            "y": 1080
        }
    },
    "lights": [
        {
            "name": "light 1",
            "type": "point",
            "luminosity": 1000.0,
            "position": {
                "x": -2.0,
                "y": -7.0,
                "z": 6.0
            },
            "color": {
                "r": 1.0,
                "g": 1.0,
                "b": 1.0
            }
        },
        {
            "name": "light 2",
            "type": "point",
            "luminosity": 300.0,
            "position": {
                "x": 7.8,
                "y": -3.0,
                "z": 5.0
            },
            "color": {
                "r": 1.0,
                "g": 0.06,
                "b": 0.08
            }
        },
        {
            "name": "light 3",
            "type": "point",
            "luminosity": 100.0,
            "position": {
                "x": 3.0,
                "y": 7.6,
                "z": 8.5
            },
            "color": {
                "r": 0.04,
                "g": 1.0,
                "b": 0.15
            }
        }
    ]
}